,title,platform,release_date,other_platforms,metascore,user_score,developer,publisher,genre,players,rating,summary,url
0,Half-Life 2,pc,"Nov 16, 2004",,96,9.2,Valve Software,VU Games,"['Action', ',                                            ', 'Shooter', ',                                            ', 'Shooter', ',                                            ', 'First-Person', ',                                            ', 'Sci-Fi', ',                                            ', 'Sci-Fi', ',                                            ', 'Arcade', ' ']",No Online Multiplayer,M,"[Metacritic's 2004 PC Game of the Year]  By taking the suspense, challenge and visceral charge of the original, and adding startling new realism and responsiveness, Half-Life 2 opens the door to a world where the player's presence affects everything around him, from the physical environment to the behaviors -- even the emotions -- of both friends and enemies. The player again picks up the crowbar of research scientist Gordon Freeman, who finds himself on an alien-infested Earth being picked to the bone, its resources depleted, its populace dwindling. Freeman is thrust into the unenviable role of rescuing the world from the wrong he unleashed back at Black Mesa. And a lot of people -- people he cares about -- are counting on him. [Vivendi Universal]",https://metacritic.com/game/pc/half-life-2
1,Grand Theft Auto: San Andreas,playstation-2,"Oct 26, 2004","['iPhone/iPad', 'PC', 'PlayStation 3', 'PlayStation 4', 'Xbox 360']",95,9.1,Rockstar North,Rockstar Games,"['Action Adventure', ',                                            ', 'Modern', ' ']",1-2 ,M,"[Metacritic's 2004 PS2 Game of the Year]  Five years ago Carl Johnson escaped from the pressures of life in Los Santos, San Andreas... a city tearing itself apart with gang trouble, drugs and corruption. Where filmstars and millionaires do their best to avoid the dealers and gangbangers. Now, it's the early 90s. Carl's got to go home. His mother has been murdered, his family has fallen apart and his childhood friends are all heading towards disaster. On his return to the neighborhood, a couple of corrupt cops frame him for homicide. CJ is forced on a journey that takes him across the entire state of San Andreas, to save his family and to take control of the streets. [Rockstar]",https://metacritic.com/game/playstation-2/grand-theft-auto-san-andreas
2,Halo 2,xbox,"Nov  9, 2004",['PC'],95,8.7,Bungie Software,Microsoft Game Studios,"['Action', ',                                            ', 'Shooter', ',                                            ', 'First-Person', ',                                            ', 'Sci-Fi', ' ']",1-16 ,M,"The Covenant alien race threatens to destroy all humankind, and the only thing standing in its way is Master Chief, a genetically enhanced supersoldier. Master Chief returns in Halo 2, which features new vehicles, weapons, environments, and more. This time, you can interact with your environment, wield two weapons at the same time, board opponents' vehicles, and even switch sides to play the role of a Covenant Elite. Halo 2 also supports broadband multiplayer action via Xbox Live. ",https://metacritic.com/game/xbox/halo-2
3,Burnout 3: Takedown,xbox,"Sep  7, 2004",['PlayStation 2'],94,7.6,Criterion Games,EA Games,"['Driving', ',                                            ', 'Racing', ',                                            ', 'Arcade', ' ']",8  Online,T,"Burnout 3 challenges you to crash into (and through) busy intersections, while creating as much damage as possible. You can battle your way to the front of the pack by taking down rivals and causing spectacular crashes. For those who thirst for crashes, the game includes a crash mode that rewards you for creating massive pileups. With multiplayer gameplay, more than 100 events, and 40 tracks, Burnout 3 provides intense speed and action.",https://metacritic.com/game/xbox/burnout-3-takedown
4,Burnout 3: Takedown,playstation-2,"Sep  7, 2004",,93,9.0,Criterion Games,EA Games,"['Driving', ',                                            ', 'Racing', ',                                            ', 'Arcade', ' ']",1-16 ,T,"Burnout 3 takes the hit series even further, now featuring a unique ""crash and burn"" racing concept and a one-of-a-kind special effects engine that delivers spectacular visuals. The intensity heats up as players race, and often crash, their way through oncoming traffic in an attempt to claim the top spot. Boasting multiple single-player, multiplayer and online crash and race modes, Burnout 3 offers players the opportunity to race through busy city streets and be rewarded for taking risks that result in heart-pounding action and electrifying crashes. [Electronic Arts]",https://metacritic.com/game/playstation-2/burnout-3-takedown
5,Tom Clancy's Splinter Cell Pandora Tomorrow,xbox,"Mar 23, 2004","['PC', 'PlayStation 3', 'Xbox 360']",93,8.6,Ubisoft Shanghai,Ubisoft,"['Action Adventure', ',                                            ', 'Modern', ' ']",1-4 ,T,"Tom Clancy's Splinter Cell: Pandora Tomorrow, the sequel to the stealth-action game Splinter Cell, once again casts you in the role of Sam Fisher, who is sent in to destroy top-secret documentation held in the embassy of militia leader Suhadi Sadono.  Use all-new moves and prototype gear to infiltrate buildings and spare the hostages.  This time, you can take your games of espionage against three other players in online multiplayer mode, in which you choose to play as either a mercenary or spy.  You've got the moves and the gear, now put them to use.",https://metacritic.com/game/xbox/tom-clancys-splinter-cell-pandora-tomorrow
6,Unreal Tournament 2004,pc,"Mar 16, 2004",,93,8.8,Epic Games,Atari,"['Action', ',                                            ', 'Shooter', ',                                            ', 'Shooter', ',                                            ', 'First-Person', ',                                            ', 'Sci-Fi', ',                                            ', 'Sci-Fi', ',                                            ', 'Arcade', ' ']",1-32 ,M,"Reload, rev up and ride out. The new Tournament is faster, higher and meaner. Land and air based vehicles take combat to a new level; while an arsenal of new weaponry, daunting arenas and battlefields and the challenge of the Assault and Onslaught modes make the gladiator blood sport of the future a brand new experience. Buckle up; it?s gonna be one hell of a ride!  [Atari]",https://metacritic.com/game/pc/unreal-tournament-2004
7,World of Warcraft,pc,"Nov 23, 2004",,93,7.4,Blizzard Entertainment,Blizzard Entertainment,"['Role-Playing', ',                                            ', 'Miscellaneous', ',                                            ', 'Massively Multiplayer Online', ',                                            ', 'Massively Multiplayer', ',                                            ', 'Board / Card Game', ',                                            ', 'Fantasy', ',                                            ', 'Fantasy', ' ']",Massively Multiplayer,T,"Four years have passed since the aftermath of Warcraft III: Reign of Chaos, and a great tension now smolders throughout the ravaged world of Azeroth. As the battle-worn races begin to rebuild their shattered kingdoms, new threats, both ancient and ominous, arise to plague the world once again. World of Warcraft is an online role-playing experience set in the award-winning Warcraft universe. Players assume the roles of Warcraft heroes as they explore, adventure, and quest across a vast world. Being ""Massively Multiplayer,"" World of Warcraft allows thousands of players to interact within the same world. Whether adventuring together or fighting against each other in epic battles, players will form friendships, forge alliances, and compete with enemies for power and glory. A dedicated live team will create a constant stream of new adventures to undertake, lands to explore, and monsters to vanquish. This content ensures that the game will never be the same from month to month, and will continue to offer new challenges and adventures for years to come. [Blizzard Entertainment]",https://metacritic.com/game/pc/world-of-warcraft
8,World Soccer Winning Eleven 7 International,playstation-2,"Feb 17, 2004",,93,8.4,KCET,Konami,"['Sports', ',                                            ', 'Traditional', ',                                            ', 'Soccer', ',                                            ', 'Sim', ' ']",1-8 ,E,"Winning Eleven 7 International features 100 teams, 21 stadiums, new player models and key additions to the Master League. Winning Eleven 7 also utilizes a custom designed engine that allows for great flexibility and customization. Upon entering a match, players will find incredibly masterful gameplay, beautifully rendered stadiums and picture-perfect player models. While on the field, players will experience true-to-life gameplay, with carefully tuned A.I., realistic pace and balance. [Konami]",https://metacritic.com/game/playstation-2/world-soccer-winning-eleven-7-international
9,World Soccer Winning Eleven 7 International,pc,"Apr  9, 2004",,92,7.0,KCET,VU Games,"['Sports', ',                                            ', 'Traditional', ',                                            ', 'Team', ',                                            ', 'Soccer', ',                                            ', 'Sim', ',                                            ', 'Sim', ' ']",1-2 ,E,"Winning Eleven 7 International features 100 teams, 21 stadiums, new player models and key additions to the Master League. Winning Eleven 7 also utilizes a custom designed engine that allows for great flexibility and customization. Upon entering a match, players will find incredibly masterful gameplay, beautifully rendered stadiums and picture-perfect player models. While on the field, players will experience true-to-life gameplay, with carefully tuned A.I., realistic pace and balance. [Konami]",https://metacritic.com/game/pc/world-soccer-winning-eleven-7-international
10,ESPN NFL 2K5,xbox,"Jul 20, 2004",['PlayStation 2'],92,8.1,Visual Concepts,Sega,"['Sports', ',                                            ', 'Traditional', ',                                            ', 'Football', ',                                            ', 'Sim', ' ']",1-4 ,E,"ESPN NFL 2K5 kicks off the football season with an improved ESPN presentation, a variety of player moves, and more. Now you can perform all-new moves during an entire season, while earning points to customize your crib with different items. The game also features new modes, including ESPN 25th Anniversary mode, where you can play in classic NFL situations over the past 25 years. First-Person Football mode returns with new camera switching, improved audio, passing control options, and more.",https://metacritic.com/game/xbox/espn-nfl-2k5
11,Rome: Total War,pc,"Sep 22, 2004",['iPhone/iPad'],92,9.0,Creative Assembly,Activision,"['Strategy', ',                                            ', 'Real-Time', ',                                            ', 'Historic', ',                                            ', 'General', ',                                            ', 'Historic', ' ']",No Online Multiplayer,T,"Rome: Total War is the next generation in epic strategy gaming from the critically acclaimed and award winning Total War brand. The aim of the game is to conquer, rule and manipulate the Roman Empire with the ultimate goal of being declared as the ""Imperator"" of Rome. Set in a time when the mighty Roman Empire emerged to conquer the known world against powerful enemies; when gladiators fought to a bloody death in the Coliseum; when Spartacus defied the might of the empire; when Hannibal led his invincible army and his war elephants across the Alps to strike fear into the very heart of Rome itself; and when Julius Caesar finally smashed the Barbarian Gauls. This was a time of brutal confrontation between civilisation and barbarism, and of civil war as the ancient world's only superpower turned on itself. A completely new Total War engine uses innovative technology and groundbreaking design to bring the world of ancient Rome to life to deliver the biggest and most cinematic battles ever seen in a videogame. So the battles in Rome: Total War maintain the epic scale that fans of Total War are used to, but now use high-detailed 3D polygonal troops and allows huge cities to be displayed on the battlefields. The result is truly spectacular. [Activision]",https://metacritic.com/game/pc/rome-total-war
12,Metroid Prime 2: Echoes,gamecube,"Nov 15, 2004",,92,8.8,Retro Studios,Nintendo,"['Action', ',                                            ', 'Shooter', ',                                            ', 'First-Person', ',                                            ', 'Sci-Fi', ' ']",1-4 ,T,"The sequel to Metroid Prime puts you in the role of bounty hunter Samus Aran once again. Your mission is to locate federation troopers who are missing on Aether--a planet torn into light and dark domains. To help you travel through the depths of light and dark, you'll have all-new beam weapons, a screw attack, and power-ups. Eliminate your enemies, solve puzzles, and open doors in an effort to restore peace to Aether. Metroid Prime 2: Echoes also features competitive multiplayer modes supporting up to four players. ",https://metacritic.com/game/gamecube/metroid-prime-2-echoes
13,Madden NFL 2005,xbox,"Aug  9, 2004","['PC', 'PlayStation 2']",91,7.3,EA Tiburon,EA Sports,"['Sports', ',                                            ', 'Traditional', ',                                            ', 'Football', ',                                            ', 'Sim', ' ']",2  Online,E,"Madden NFL 2005 introduces the Hit Stick, a new feature that lets players turn a game around with a crucial tackle. Along with all-new defensive preplay controls and defensive artificial intelligence enhancements, the defense now has a diverse arsenal of weapons available. Also, the depth of Franchise mode grows with the addition of Storyline Central, a weekly radio talk show that discusses current stories regarding your team and the league. With even more Franchise mode additions, hundreds of new animations, and the new Create-a-Fan feature, Madden NFL 2005 takes the series to the next level.",https://metacritic.com/game/xbox/madden-nfl-2005
14,Ratchet & Clank: Up Your Arsenal,playstation-2,"Nov  3, 2004",['PlayStation 3'],91,9.0,Insomniac Games,SCEA,"['Action', ',                                            ', 'Platformer', ',                                            ', '3D', ' ']",8  Online,T,"(Also known as ""Ratchet & Clank 3"")  The third installment of the Ratchet & Clank franchise incorporates new elements of gameplay not seen previously in the series, including online and offline multiplayer capabilities that will appeal to a wide variety of players. Ratchet and Clank: Up Your Arsenal returns gamers to Planet Veldin, the setting of the original Ratchet & Clank, where the duo set off on a gripping new adventure through a multitude of diverse planets to fight for galactic peace. Players will be able to earn up to 20 weapons (including online and offline) with up to four levels of upgrades for most weapons, plus new high-tech gadgets to help them through their journey. [SCEA]",https://metacritic.com/game/playstation-2/ratchet-clank-up-your-arsenal
15,Metal Gear Solid 3: Snake Eater,playstation-2,"Nov 17, 2004",['3DS'],91,8.0,KCEJ,Konami,"['Action Adventure', ',                                            ', 'Modern', ' ']",1 Player,M,"In the struggle to achieve world peace and world dominance, rivaling governments are secretly developing weapons technology that could threaten the future existence of life. Destined to be the first, a race ensues to become the ultimate nation. A special elite tactical soldier is summoned to penetrate deep in the heart of enemy territory and obtain intel about ""Metal Gear,"" a prototype weapon with nuclear capabilities. This is your mission and you must infiltrate alone. Interactive environments where traps catch enemies and prey. Rely on camouflage, combat, hunting and instincts to survive. Set in the 1960s where politics and war are shaping real world history. Blockbuster musical score composed by Harry Gregson-Williams. [Konami]",https://metacritic.com/game/playstation-2/metal-gear-solid-3-snake-eater
16,Ninja Gaiden,xbox,"Mar  2, 2004",,91,8.8,Team Ninja,Tecmo,"['Action Adventure', ',                                            ', 'Fantasy', ' ']",1 Player,M,"Ninja Gaiden first debuted in the 1988 and now the young ninja returns.  As Ryu Hayabusa, you seek revenge after the Vigor Empire massacres your clan.  Skilled in battle actions and ninja moves, you are well prepared to hunt down the Holy Emperor and reclaim the magic sword ""Ryuken."" Ninja Gaiden features killer gameplay, stunning graphics, and new weapons such as the Dragon Sword, warhammer, shurikens, and nunchakus. Plus, there are massive levels filled with enemies and Xbox Live feature will enable future high score tournaments and downloadable content.",https://metacritic.com/game/xbox/ninja-gaiden
17,Tiger Woods PGA Tour 2005,pc,"Sep 20, 2004",['PlayStation 2'],91,3.9,Headgate,EA Sports,"['Sports', ',                                            ', 'Traditional', ',                                            ', 'Individual', ',                                            ', 'Golf', ',                                            ', 'Sim', ',                                            ', 'Sim', ' ']",1-8 ,E,"TigerProofing is a revolutionary course-altering system that allows players to modify course dynamics and create the most intensely competitive course imaginable. Alter tee-box length, width and patterns on fairways and greens, the depth of a greenside bunker, and even the color of the leaves on the trees, course moisture and the season which you play. Take on the legends of golf including Arnold Palmer, Jack Nicklaus, and Ben Hogan and become a legend yourself! EA SPORTS GameFace II: The industry-leading GameFace technology just got a whole lot deeper with more control and freedom to express your creative vision from a youthful prodigy to a grizzled old veteran. Eight new licensed courses and two new fantasy courses have been added for a total of 14 courses. New licensed courses for console only include Coeur d?Alene and Colonial Country Club. New licensed courses for both console and PC include, Sherwood Country Club, Fancourt Golf Club Estate and Troon North ? Monument Course. Compete as or against 15 different PGA TOUR players including Tiger Woods, John Daly, Vijay Singh, Charles Howell III, Notah Begay III, and Jesper Parnevik, among others. Total Precision Swing: New putting and chipping systems allow for more control on the green or when you leave an approach shot short. [EA Sports]",https://metacritic.com/game/pc/tiger-woods-pga-tour-2005
18,Madden NFL 2005,playstation-2,"Aug  9, 2004",['PC'],91,8.0,EA Tiburon,EA Sports,"['Sports', ',                                            ', 'Traditional', ',                                            ', 'Football', ',                                            ', 'Sim', ' ']",2  Online,E,"Force the action on defense in Madden NFL 2005. New defensive tools allow you to make more plays and be in on all of the action. The all-new Hit Stick lets you lay the big hit to turn the momentum of the game in your favor. Modify pre-snap assignments, including double teams and player-specific match ups, for any defensive player on the field. With the new Storyline Central, you get the inside scoop around the league from radio host Tony Bruno, along with local and national newspapers, to help you make critical franchise decisions. New Hit Stick — Change the momentum of a game by using the right analog stick to make a huge hit, force a turnover, and send the crowd into a frenzy. Time it just right or you'll get burned for a big play. Enhanced Franchise Mode — Players now react to everything that happens in the franchise—reward a hard-working player by naming him team captain or trade away unhappy players. The new game-by-game progression system rewards players for their performance during the season. Your team's crowd is now customizable with new Create-a-Fan. Be on the lookout for team-specific super fans via all-new 3D fan scenes. New EA SPORTS Online - Take on the best Madden players in quick tournaments, or compete in a mini-game of Rushing Attack. Improved EA SPORTS Fair Play keeps the playing field level. [Electronic Arts]",https://metacritic.com/game/playstation-2/madden-nfl-2005
19,The Sims 2,pc,"Sep 14, 2004",['PlayStation 2'],90,8.7,Maxis,EA Games,"['Simulation', ',                                            ', 'Miscellaneous', ',                                            ', 'Virtual Life', ',                                            ', 'Virtual', ',                                            ', 'Virtual Life', ' ']",No Online Multiplayer,T,"The Sims 2 is the first entirely-new generation of The Sims, the ground-breaking game that allowed players to create and control people. The Sims 2 challenges you to direct the journey of your Sims' lives as they grow from infancy through childhood, teenage life and adulthood. Starting with a personality that you give them (or that they inherit from their parents), your Sims will develop in unique ways based on your choices and influence. As they progress through life, your Sims will collect memories which shape who they are, what options they have and how they behave. These experiences can have a short or long-term effect on relationships between family members and friends. Experiences between Sims when they are children can affect their relationships as teens and adults. Your Sims can have casual friendships or make life-long enemies. [Electronic Arts]",https://metacritic.com/game/pc/the-sims-2
20,ESPN NFL 2K5,playstation-2,"Jul 20, 2004",,90,8.6,Visual Concepts,Sega,"['Sports', ',                                            ', 'Traditional', ',                                            ', 'Football', ',                                            ', 'Sim', ' ']",1-2 ,E,"ESPN NFL 2K5 is uniting fans with a coupling of the most responsive and intense gameplay and the richest multi-player gaming experience possible. Maximum Tackling brings unique on-field control allowing gamers to go for the wrap-up tackle or deliver the big highlight hit. The addition of the V.I.P. System? allows gamers to play friends, even if they're not there! Players are invited to show off their coaching skills in Franchise mode and utilize Weekly Prep to fully plan the training schedule, intensity, and regimen each week. Full online leagues and tournament play with living rosters rounds out the most complete online experience. [Sega]",https://metacritic.com/game/playstation-2/espn-nfl-2k5
21,MVP Baseball 2004,playstation-2,"Mar  9, 2004",['PC'],90,8.5,EA Sports,EA Sports,"['Sports', ',                                            ', 'Traditional', ',                                            ', 'Baseball', ',                                            ', 'Sim', ' ']",1-2 ,E,"Step up to the plate with MVP Baseball 2004. The fundamentals of hitting, pitching, fielding, and base running have been reproduced like never before to give you complete control over every aspect of the game. From swinging for the fences or protecting the plate when you have a two-strike count, the all-new batting model provides unprecedented command of each type of swing in every situation. With great gameplay and many additional features such as Pitching Challenge and Dynasty Mode, MVP Baseball 2004 wins the pennant as the most innovative and realistic baseball experience ever created. Groundbreaking Hitting Control: From hitting to the opposite field to pulling the ball down the line to swinging for the fences, every swing type is included. You Control the Field: Leap over the wall and rob home runs, hook slide to avoid tags, and take out the catcher at home with all-new player control. Pick Your Park: With all-new crowd chants, the addition of classic stadiums, and new lighting to signify various start times for your biggest games, MVP Baseball 2004 puts you in the best seat in the house. Your Dynasty Begins Now: Take full control of your franchise on all the levels -- from the minors to the pros. Play, sim, or manage each game all the way to the World Series. Swing for the Fences Online: Go yard against players across the country in one-on-one or Tournament games, while talking up your game with EA SPORTS? Talk [Electronic Arts]",https://metacritic.com/game/playstation-2/mvp-baseball-2004
