,title,platform,release_date,other_platforms,metascore,user_score,developer,publisher,genre,players,rating,summary,url
60,Final Fantasy Crystal Chronicles,gamecube,"Feb  9, 2004",,80,8.9,Square Enix,Nintendo,"['Role-Playing', ',                                            ', 'Action RPG', ' ']",1-4 ,T,"The Final Fantasy series explodes onto the GameCube with action-packed multiplayer gameplay and an epic storyline seeped in Final Fantasy style and lore.  Final Fantasy: Crystal Chronicles tells the tale of a land covered in poisonous miasma where people depend on precious crystals to stay alive.  By using Game Boy Advance systems as controllers, four players can team up to solve puzzles, defeat enemies, and survive in a land teeming with danger.  While much of the gameplay involves hacking and slashing through colorful monsters, Crystal Chronicles is all about teamwork.",https://metacritic.com/game/gamecube/final-fantasy-crystal-chronicles
61,NFL Street,playstation-2,"Jan 13, 2004",,80,8.8,EA Tiburon,EA Sports,"['Sports', ',                                            ', 'Traditional', ',                                            ', 'Football', ',                                            ', 'Arcade', ' ']",1-4 ,E,"Hard-hitting 7-on-7 arcade gameplay challenges players to show their skills on both offense and defense. Big jukes with bone-crunching tackles, pitches, and a wealth of showboat moves are available. Create a player and build a team, filling all positions. Choose from hundreds of swappable clothing, accessories, colors and logos. NFL Challenge: Bulldoze through 31 teams while building the ultimate team with dozens of unlockables. Pick Up Game: You're always the captain and you take turns with your opponent, selecting your team from 40 randomly selected NFL stars. More than 300 current NFL stars and legends such as Barry Sanders. Each player model exaggerates the real-life features of their counterparts. Great plays earn Showboat points which will eventually reward gamers with a Gamebreaker. Gamebreakers put a player into ""the zone"" where they can plow through the opposing team or knock the ball loose on defense. Online Play for PlayStation 2: Rule the streets from coast-to-coast. [Electronic Arts]",https://metacritic.com/game/playstation-2/nfl-street
62,WWE SmackDown! vs. Raw,playstation-2,"Nov  2, 2004",,80,8.6,Yuke's,THQ,"['Action', ',                                            ', 'Fighting', ',                                            ', 'Wrestling', ' ']",2  Online,T,"From the most successful wrestling game series of all-time comes the next phenom in sports entertainment ? WWE SmackDown! vs. RAW.Two worlds will collide as the most elite Superstars square off on the Playstation 2. WWE programming comes to life with Superstar Voice Over and commentary throughout the unparalleled season mode. An abundance of new gameplay mechanics provide full control over all aspects of the game including new stare-downs, chop battles, submission reversals, match tactics, and overhauled Royal Rumble controls. The Divas are hotter than ever with an enhanced bra and panties match and to polish off the robust roster, from the halls of immortality, come a handful of the most celebrated legends to ever lace up their boots. [THQ]",https://metacritic.com/game/playstation-2/wwe-smackdown!-vs-raw
63,Ground Control II: Operation Exodus,pc,"Jun 23, 2004",,80,8.4,Massive Entertainment,Sierra Entertainment,"['Strategy', ',                                            ', 'Real-Time', ',                                            ', 'Sci-Fi', ',                                            ', 'Sci-Fi', ',                                            ', 'General', ',                                            ', 'Tactics', ' ']",Up to 8 ,T,"Prepare for Battle. Ground Control II: Operation Exodus is a real-time 3D action strategy set in a distant and futuristic universe. The game mainly focuses on explosive combat missions where the player will control squads of infantry, tanks, artillery and helicopters as the story unfolds. [Vivendi Universal]",https://metacritic.com/game/pc/ground-control-ii-operation-exodus
64,Fritz 8 Deluxe,pc,"Dec  1, 2004",,80,6.7,ChessBase,Viva Media,"['Miscellaneous', ',                                            ', 'Board Games', ',                                            ', 'Board Games', ',                                            ', 'Board / Card Game', ' ']",2  Online,E,"Fritz Chess 8, written by Frans Morsch, is identical to the one that fascinated the world in the man vs Machine duel against the human world champion. Millions of chess fans watched the games live on the Internet - the match ended in a 4:4 tie. ""Deep Fritz is stronger than Deep Blue,"" said world champion Vladimir Kramnik, who had carefully studied the program. But don't be afraid, Fritz is not just a chess playing monster. It is a friendly chess partner for beginners and amateurs. It will teach you to play chess from scratch, and can automatically adjust its playing strength to suit your needs. It will warn you when you go wrong in a game, giving you hints on how to play better. [Excalibur Publishing]",https://metacritic.com/game/pc/fritz-8-deluxe
65,Karaoke Revolution,xbox,"Nov 10, 2004",,80,6.8,Secret Level,Konami,"['Miscellaneous', ',                                            ', 'Rhythm', ',                                            ', 'Music', ' ']",1-8 ,E,"Turn your Xbox into a high-end, interactive karaoke machine with Karaoke Revolution, the latest in Konami's line of music video games.  Karaoke Revolution features a varied list of tunes from current hits to yesterday's classics.  With the Xbox Communicator, you'll not only sing song, but get judged on your performance--so make sure you're on key.  Take your voice to the ultimate concert venue in Showtime mode. This version of Karaoke Revolution also features more than 10 Motown classics and additional songs that you can download via Xbox Live.",https://metacritic.com/game/xbox/karaoke-revolution
66,Vampire: The Masquerade - Bloodlines,pc,"Nov 16, 2004",,80,8.9,Troika Games,Activision,"['Role-Playing', ',                                            ', 'First-Person', ',                                            ', 'Western-Style', ' ']",No Online Multiplayer,M,"Presenting Vampire: The Masquerade - Bloodlines, a visually stunning first-person role-playing adventure that combines intense first-person action with an open, non-linear world, rich character development and an immersive storyline. Built using Valve Source Technology - the same game engine technology used to power Half-Life 2, Vampire: The Masquerade - Bloodlines is based on White Wolf's pen-and-paper RPG series, and developed by renowned RPG developer - Troika Games. The game plunges players into the dark and gritty vampire underworld of modern day L.A. as a creature of the night, interacting with and battling mortals and other creatures of darkness with an incredible array of vampire powers, skills and traits. [Activision]",https://metacritic.com/game/pc/vampire-the-masquerade---bloodlines
67,Star Wars: Battlefront,xbox,"Sep 20, 2004",['PlayStation 2'],80,8.3,Pandemic Studios,LucasArts,"['Action', ',                                            ', 'Shooter', ',                                            ', 'First-Person', ',                                            ', 'Sci-Fi', ' ']",16  Online,T,"Star Wars Battlefront puts you in the heat of the action as you relive all of the intense battles from the classic and prequel eras of the Star Wars universe. You'll fight in more than 15 environments across 10 diverse planets, including Hoth, Geonosis, Yavin, Tatooine, and Naboo. You can play as one of more than 20 different soldier types from four factions, as well as take control of 15 diverse ground and air vehicles, such as the AT-ST, X-Wing, and speeder bike.",https://metacritic.com/game/xbox/star-wars-battlefront
68,MX Unleashed,playstation-2,"Feb 17, 2004",['Xbox 360'],80,8.7,Rainbow Studios,THQ,"['Driving', ',                                            ', 'Racing', ',                                            ', 'Motorcycle', ',                                            ', 'Motocross', ' ']",1-2 ,E,"Rainbow Studios, the masters of off road racing games, returns to their heritage to bring the definitive next generation MX game to life. Challenge yourself in the ultimate off-road playground, a never before seen freeworld mode filled with treacherous terrain, mini games, and machine races. Go bar to bar against the top champions in the world through the season long Supercross and Outdoor National series in an extensive career mode. Prepare yourself for mud, dirt, high speeds, and serious attitude. [THQ]",https://metacritic.com/game/playstation-2/mx-unleashed
69,Donkey Kong Country 2,game-boy-advance,"Nov 15, 2004",,80,8.6,Rare Ltd.,Nintendo,"['Action', ',                                            ', 'Platformer', ',                                            ', '2D', ' ']",1-2 ,E,"The Donkey Kong Country series returns to the Game Boy Advance in a sequel that features Dixie Kong. She and Diddy Kong must team up to rescue Donkey Kong from the evil Kaptain K. Rool. You'll play as both Diddy and Dixie, and master their different attacks. Test your skills and beat the clock in Diddy's Dash, or race against your friends to see who's the fastest. You can play the game solo or challenge your friends in new bonus games such as Funky's Flights and Bag a Bug.",https://metacritic.com/game/game-boy-advance/donkey-kong-country-2
70,Spider-Man 2,gamecube,"Jun 28, 2004",['PlayStation 2'],80,8.4,Treyarch,Activision,"['Action Adventure', ',                                            ', 'Sci-Fi', ' ']",1 Player,T,"The city is at risk, and only you can save it from the evil clutches of an old enemy--the powerful Electro. He has a mysterious new device that makes his million volts of destruction even deadlier. But now Spider-Man has Insulated Armor, which makes him impervious to electricity, in addition to new powers such as Ice and Taser-Webbing. With your new bag of tricks, you can stop Electro, Sandman, and other villains' nefarious schemes to bring the city to its knees. ",https://metacritic.com/game/gamecube/spider-man-2
71,Hitman: Contracts,playstation-2,"Apr 20, 2004",['PC'],80,8.1,Io Interactive,Eidos Interactive,"['Action', ',                                            ', 'Shooter', ',                                            ', 'Third-Person', ',                                            ', 'Modern', ' ']",1 Player,M,"Hitman: Contracts takes you into the mind of Agent 47, the most ruthlessly efficient contract killer in history. The game begins in Paris as Agent 47 finds himself wounded and trapped in what is a dangerous situation, even for him. Hitman: Contracts explores the dark psychology of killing for a living and promises to be the darkest, most disturbing episode in the series. [Eidos Interactive]",https://metacritic.com/game/playstation-2/hitman-contracts
72,The Suffering,pc,"Jun  8, 2004",['PlayStation 2'],80,8.0,Surreal Software,"Encore Software, Inc.","['Action Adventure', ',                                            ', 'Horror', ',                                            ', 'Horror', ',                                            ', 'Survival', ' ']",No Online Multiplayer,M,"Players assume the role of Torque, a man convicted of a horrible crime that he may or may not have committed. He's sentenced to life in Abbott State Penitentiary, a haunted place that hides a terrible secret, one that threatens both the prison guards and the hardened criminals that call this isolated hell home. Torque's tale unfolds in nine terrifying levels, where grisly mutated creatures, sadistic prisoners and guards lurk around every corner. A variety of deadly weapons are at his disposal to help him survive and escape from prison. In addition, Torque has a ""rage meter"" that, when filled, transforms him into a hideous and bloodthirsty creature that looks and feels right at home with the other dozen monstrosities stalking his every move. Torque will be able to interact with other inmate NPC's and enlist their help in escaping, or take them out if they get in his way. The Suffering also features three distinct endings based on how the game is played. In revealing Torque's story, he could be a cold-blooded killer, a man wrongfully accused, or something far, far worse. [Encore Software]",https://metacritic.com/game/pc/the-suffering
73,Gish,pc,"Sep 17, 2004",,80,7.0,Chronic Logic,GarageGames,"['Action', ',                                            ', 'Platformer', ',                                            ', 'Platformer', ',                                            ', '2D', ',                                            ', '2D', ' ']",1-2 ,T,"Gish isn't your average hero, in fact he's not your average anything.. see Gish is a ball of tar. A Sunday stroll with his lady friend Brea goes awry when a shadowy figure emerges from an open man hole and pulls Brea into the ground below. Following Brea's calls for help Gish suddenly finds himself in the subterranean sewers of Dross, a long forgotten city filled with twisting corridors, evil traps and some of the most demented creatures imaginable. With his gelatinous structure as his only means of defense Gish must follow the echoing cries of his damsel in distress deep into the earth bellow. What freakish creatures dwell in this subterranean land? Who is Brea's captor? And just how far down does the rabbit hole go? Life isn't easy when you're a 12 pound ball of tar... [Chronic Logic]",https://metacritic.com/game/pc/gish
74,NCAA March Madness 2005,xbox,"Nov 17, 2004",['PlayStation 2'],80,6.7,EA Canada,EA Sports,"['Sports', ',                                            ', 'Traditional', ',                                            ', 'Basketball', ',                                            ', 'Sim', ' ']",2  Online,E,"Lead one of more than 320 Division I schools to the Big Dance with NCAA March Madness 2005. Now you can use scouting reports and locker room videos from the nation's top college coaches to create a game plan that takes you to the top. Along with a revamped Dynasty mode, online play, and Mascot and Rivalry modes, NCAA March Madness 2005 lets your replay classic matchups between great college basketball teams. The game also adds new mascots, cheerleaders, arenas, crowd chants, and fight songs.",https://metacritic.com/game/xbox/ncaa-march-madness-2005
75,Yourself!Fitness,xbox,"Sep 27, 2004","['PC', 'PlayStation 2']",80,7.0,Respondesign,Respondesign,"['Miscellaneous', ',                                            ', 'Edutainment', ' ']",1 Player,E,"Make a promise to yourself today and begin a commitment to your health for life with Yourself!Fitness. Maya, your personal trainer, helps you choose and achieve your health and fitness goals. She can guide you through dynamic workouts featuring more than 500 unique exercises. You can even set up a meal plan, customize your workout, and receive progress reports. Choose your music, your mood, and your focus and Maya will take care of the rest.",https://metacritic.com/game/xbox/yourself!fitness
76,Kirby & the Amazing Mirror,game-boy-advance,"Oct 18, 2004",,80,8.7,Flagship,Nintendo,"['Action', ',                                            ', 'Platformer', ',                                            ', '2D', ' ']",1-4 ,E,"Once again, Kirby must save the kingdom from evil. But this time he'll need some backup. As Kirby, you can call up one of four alter egos for help during your quest. Each character features new copy abilities that range from arrow-shooting to melee moves. Practice your skills in new side games, such as Crackity Hack and Speed Eaters. In addition to new abilities and subgames, Kirby & the Amazing Mirror also introduces new multiplayer modes.",https://metacritic.com/game/game-boy-advance/kirby-the-amazing-mirror
77,Star Ocean: Till the End of Time,playstation-2,"Aug 31, 2004",['PlayStation 4'],80,8.5,Tri-Ace,Square Enix,"['Role-Playing', ',                                            ', 'Action RPG', ' ']",1-2 ,T,"The first PlayStation 2 installment in the acclaimed science fiction RPG series, the Director's Cut version is considered to be the culmination of the developer?s true vision. STAR OCEAN was originally released with two versions in Japan. The development time was extended for the North American release in order to incorporate the extra features of the Director's Cut, the only stateside release of the title. STAR OCEAN builds on the first-rate concepts of earlier games in the series and leverages the technological capabilities of the PlayStation 2 to surpass them. In addition, the larger data capacity of the Director?s Cut allows for multiple added extras providing the most complete game package possible. Incorporating the new features with gorgeous, extended cinematic sequences and an unparalleled real-time battle system, including a new VS. mode, STAR OCEAN is sure to attract a new group of admirers and thrill the longtime fans of the series. STAR OCEAN's protagonist, Fayt Leingod brings his family and childhood friend, Sophia Esteed to the Federation-managed resort planet Hyda for a long-deserved vacation. Their dreamy holiday turns into a nightmare when Hyda is attacked by an unknown space military. In the heat of the attack, Fayt is separated from Sophia and his family and begins an emotional quest into the unknown to find his loved ones. [Square Enix]",https://metacritic.com/game/playstation-2/star-ocean-till-the-end-of-time
78,R-Type Final,playstation-2,"Feb  3, 2004",,79,8.6,Irem,Eidos Interactive,"['Action', ',                                            ', 'Shooter', ',                                            ', 'Scrolling', ' ']",1 Player,E,"It all began in 1987 with a revolutionary arcade shooter called R-Type. Now the classic shooter is back for a final appearance with new features and the same exciting, revolutionary gameplay that started it all. Use the unique Force System to power-up your ship as you choose and send it into battle against the evil Bydo. With over 100 ships to choose from and an almost unlimited amount of customization options, R-Type Final is the definitive shooter on the PlayStation2. [Eidos Interactive]",https://metacritic.com/game/playstation-2/r-type-final
79,Otogi 2: Immortal Warriors,xbox,"Oct 21, 2004",,79,8.2,From Software,Sega,"['Action Adventure', ',                                            ', 'Fantasy', ' ']",1 Player,T,"Otogi 2 takes place directly after the events chronicled in the original Otogi: Myth of Demons. Raikoh, the famed undead warrior from the original game, rises again to save Japan from an onslaught of demons. This time, he is joined by six other selfless warriors who have taken their own lives to resurrect Raikoh. As you acquire more special items, you can increase each character's strengths and abilities. Fulfill your destiny in Story mode, or destroy everything in the new Havoc mode.",https://metacritic.com/game/xbox/otogi-2-immortal-warriors
80,Return to Mysterious Island,pc,"Nov  2, 2004",['iPhone/iPad'],79,7.7,Kheops Studio,DreamCatcher Interactive,"['Adventure', ',                                            ', 'First-Person', ',                                            ', 'Point-and-Click', ',                                            ', 'Modern', ',                                            ', 'Modern', ' ']",No Online Multiplayer,T,"Return to Mysterious Island follows Mina, a strong young woman alone on a round-the-world sailing expedition. Caught in a tremendous storm, she becomes stranded on the shores of a wild and apparently uninhabited island. As she explores her new surroundings, she uncovers artifacts, living spaces and technologies left behind by the people who came before her to this uncharted island. Creating a new life, Mina builds a home from the remains of Granite Rock and uses her survival skills against the wilds of the jungle. She soon becomes aware of a figure in the shadows who, seemingly aware of her troubles, offers her assistance. She eventually identifies this figure as the unsettled ghost of Captain Nemo, whose body is located in the Nautilus deep below the island shore. Piecing together the hints and clues he provides, Mina must travel to the Nautilus, retrieve his body and give him a proper burial in order to free his tortured soul. Players will solve a variety of clever puzzles and use the various technologies found on the Nautilus to help on their return to civilization. [Adventure Company]",https://metacritic.com/game/pc/return-to-mysterious-island
81,X-Men Legends,playstation-2,"Sep 21, 2004",,79,8.3,Raven Software,Activision,"['Role-Playing', ',                                            ', 'Action RPG', ' ']",1-4 ,T,"X-Men: Legends is the first game to capture the complete essence of the X-Men by allowing players to control multiple characters that fight together as a team. The game blends the best parts of the movies, comic books in a fantastic new adventure that allows the you to develop your specialized powers as you succeed through your missions. Penned by Man of Action, a studio of comic industry veterans, X-Men: Legends begins with the rescue of a young mutant and takes players through an engrossing plot that could unite mutant-kind, yet destroy the human race in the process. Along the way, players will be able to assemble their ideal X-Men crew from over 15 of the most popular characters from the last 40 years, including Wolverine™, Cyclops™, Storm™, Nightcrawler™, Colossus™, Gambit™ and Beast™, to name a few. However, before players load-up their squad with heavy hitters, they will have to take their foes' abilities into consideration as certain situations may benefit from the abilities of specific X-Men. While Cyclops' optic blasts and Colossus' immense strength are great for clearing a path through hordes of enemies, players can opt to bring Wolverine and Nightcrawler along on a stealth intensive mission to help circumvent detection devices. Once the action begins, players can take control of any member of their squad and even execute multi-character combinations such as the famous Wolverine/Colossus Fastball Special. As they progress through the game, characters will gain experience points that players can use to upgrade the X-Men's abilities and even learn new fighting styles. [Activision]",https://metacritic.com/game/playstation-2/x-men-legends
82,Final Fantasy I & II: Dawn of Souls,game-boy-advance,"Nov 29, 2004",,79,7.9,Tose Software,Nintendo,"['Role-Playing', ',                                            ', 'Console-style RPG', ' ']",1 Player,E,"Relive the first two chapters in the Final Fantasy saga--this time with all-new story elements and gameplay. Now you can experience new dungeons, storylines, and characters. Furthermore, you can master the enhanced control systems, and you can save your game at anytime. In Final Fantasy, you control a group of heroes on a mission to save a kingdom in turmoil. The sequel lets you swap out members of your parties during the game, allowing you to experience the adventure with more characters.",https://metacritic.com/game/game-boy-advance/final-fantasy-i-ii-dawn-of-souls
83,La Pucelle: Tactics,playstation-2,"May  4, 2004",['PC'],79,8.7,Nippon Ichi Software,Mastiff,"['Strategy', ',                                            ', 'Turn-Based', ',                                            ', 'Fantasy', ' ']",1 Player,T,"La Pucelle: Tactics is the tactical RPG from Nippon Ichi, creators of ""Disgaea."" La Pucelle: Tactics is a tale of betrayal and double cross, monsters in human form and humans in monster form, set in an alternate medieval Europe. The unlikely hero is a smart mouthed and undisciplined sixteen year old who just passed her exorcism exams and her comrades in La Pucelle, a demon hunting squad. Features Dark Portals and Purification: Brand new to the RPG world, use your powers to purify defiled ground and enemies. If pulled off right the effect is like having a super-giant combo. Damage multiple enemies at once, stop new enemies from appearing, strengthen items in real time. Fast leveling system: Items, characters and skills can increase every round of battle for well earned instant gratification. Carry up to 149 items and use them to learn special magic. Turn enemies to allies. Bring up to 8 units into battle. Seize the high ground! Battlefield terrain will vary in height: attacking down is way better than being attacked from above. [Mastiff]",https://metacritic.com/game/playstation-2/la-pucelle-tactics
