,title,platform,release_date,other_platforms,metascore,user_score,developer,publisher,genre,players,rating,summary,url
32,Warlords Battlecry III,pc,"May 19, 2004",,73,8.5,Infinite Interactive,Enlight Software,"['Strategy', ',                                            ', 'Real-Time', ',                                            ', 'Fantasy', ',                                            ', 'General', ' ']",No Online Multiplayer,T,"It was only a matter of time before the Selentine Merchants ventured too far from their trade routes, over the South Seas, searching for rich lands that might lay beyond. But they were unprepared for the terrors they would awaken, and the devastation they would unleash upon the world of Etheria. At first, the southern continent seemed a peaceful, idyllic place - warm and tropical. But that would soon change. Although rich in gold and silver, the Selentines soon met the inhabitants of this new land - snake-like creatures who called themselves Ssrathi and their land¡K Keshan. They were names that would come to be feared in later years. The Selentines slew these first Ssrathi and took their gold, thinking them simple and primitive. But Nature too is simple and primitive, and it wields the most destructive powers and so it was with the Ssrathi. Their empire was large, their knowledge of magic extensive, and their Shaman-King, Iriki, was a creature whom even the Gods rightly feared. The war that followed would change the face of Etheria forever. Join with the many races of Etheria as you fight your way through the ruins, jungles and deserts of the southern continent of Keshan, searching for new lands to conquer, and the treasure with which you might build an Empire. Or take the role of the Ssrathi the snakemen of Keshan as they repel the invaders and then unleash the full might of their empire upon the northern realms! [Enlight Software]",https://metacritic.com/game/pc/warlords-battlecry-iii
33,The Lord of the Rings: The Third Age,playstation-2,"Nov  2, 2004",,73,8.0,EA Games,EA Games,"['Role-Playing', ',                                            ', 'Console-style RPG', ' ']",1-2 ,T,"The Lord of the Rings: The Third Age roleplaying game is an epic quest in which players take on the roles of new characters choosing their own path through Middle-earth while interacting with the heroes and villains of the trilogy. Based on New Line Cinema and Peter Jackson's acclaimed film adaptations of J.R.R. Tolkien's classic The Lord of the Rings trilogy, The Lord of the Rings, The Third Age videogame allows players to adventure through Middle-earth, building a party of heroes as they journey. Players battle on the side of the Fellowship, but can unlock additional encounters where they fight on the side of Sauron as they progress. In the game, players interact with the characters of the Fellowship in a unique structure, taking on individual quests while intersecting the major events of the film trilogy that drive the story forward. Parties traverse through both familiar and seldom-glimpsed locations, using an innovative turn-based battle system as they fight, encountering the demonic Balrog in the Mines of Moria, defending the fallen city of Osgiliath, or trying to destroy Helm's Deep. [Electronic Arts]",https://metacritic.com/game/playstation-2/the-lord-of-the-rings-the-third-age
34,Classic NES Series: Zelda II: The Adventure of Link,game-boy-advance,"Oct 25, 2004",,73,7.2,Nintendo,Nintendo,"['Role-Playing', ',                                            ', 'Action RPG', ' ']",1 Player,E,"The sequel to The Legend of Zelda combines side-scrolling action with role-playing game elements. In Zelda II: The Adventure of Link, you'll embark on a quest to find the Triforce of Courage, awaken Princess Zelda from an evil wizard's spell, and save Hyrule from ruin. As Link, you can learn magic spells and collect items to increase your power. Zelda II features magic that lets you fly, throw fireballs, jump higher, and more.",https://metacritic.com/game/game-boy-advance/classic-nes-series-zelda-ii-the-adventure-of-link
35,Scrapland,pc,"Nov  4, 2004",,72,8.2,Mercury Steam,Enlight Software,"['Action', ',                                            ', 'Action Adventure', ',                                            ', 'General', ',                                            ', 'Sci-Fi', ',                                            ', 'General', ' ']",16  Online,T,"(Also known as ""American McGee's Scrapland"")  Scrapland is a third-person 3-D action-adventure game set in a futuristic robotic world where humans are feared and frowned upon. The game delivers a solidly engaging, sometimes humorous adventure narrative that combines a unique blend of combat and racing. Players take on the role of D-Tritus, an intergalactic traveler who finds himself involved in a series of mysterious murders committed in a world where death had been previously unheard of. With the ability to transform into any of 15 character types each with their own unique powers and the skill to pilot hundreds of gunships found in the game, D-Tritus attempts to solve this murderous conspiracy plaguing the city of Chimera. Control hundreds of ships, each with their own variation in handling depending on weight, power and aerodynamics. Create your own fleet and build customized gunships based on plans found in the game. [Enlight Software]",https://metacritic.com/game/pc/scrapland
36,Bujingai: The Forsaken City,playstation-2,"Jul 25, 2004",,72,7.9,Taito Corporation,Bam Entertainment,"['Action', ',                                            ', ""Beat-'Em-Up"", ' ']",1 Player,T,"(Also known as ""Bujingai: Swordmaster"")  In the 23rd Century, an attempt to develop a new source of energy has gone horribly wrong and 70% of the world's population is instantly wiped out. The survivors learn how to create energy from their own bodies, giving them superhuman abilities. The process of harnessing the power of these abilities is simply referred to as ""Skill"". For 400 years, the survivors transformed these abilities into a new and deadly fighting art. Now at the dawn of a new age, simply called the Age of Skill, mankind is faced with a new threat. A rift into a demon dimension has been opened, unleashing hordes of fiends on an isolated island city in Asia. One warrior, a master of Skill, travels to the city to combat this invasion. Armed with a pair of swords, and an arsenal of magic spells, Lau must combat the demons and try to rescue what's left of the survivors. [BAM! Entertainment]",https://metacritic.com/game/playstation-2/bujingai-the-forsaken-city
37,Need for Speed Underground 2,game-boy-advance,"Nov 15, 2004",['PlayStation 2'],72,7.8,Pocketeers,Electronic Arts,"['Driving', ',                                            ', 'Racing', ',                                            ', 'GT / Street', ' ']",1-2 ,E,"The next installment in the Need for Speed Underground series takes you to a free-roaming city comprised of five neighborhoods. As you explore the city, you'll encounter rival racers who will show you all the hot spots in underground racing. After each race, you can improve your car's performance with various upgrades, ranging from the gear ratio to the suspension. The game includes more than 30 tuner cars from a variety of manufacturers, such as Mitsubishi, Nissan, Toyota, and more. You can even challenge racers from around the world in the game's online mode.",https://metacritic.com/game/game-boy-advance/need-for-speed-underground-2
38,Puyo Pop Fever,gamecube,"Jul 20, 2004",,72,8.4,Sonic Team,Sega,"['Miscellaneous', ',                                            ', 'Puzzle', ',                                            ', 'Matching', ' ']",1-2 ,E,"From the popular Japanese puzzle game Puyo Pop comes Puyo Pop Fever, designed for a new generation of console gamers. Simple yet challenging, the game features both single-player and multiplayer options. The additional fever mode adds a different twist to the gameplay, providing the opportunity to create a string of chain reactions that can annihilate your opponent. Puyo Pop Fever mixes both 2D and 3D elements, and as the action speeds up, you'll see more special effects combined with ""anime"" graphics. ",https://metacritic.com/game/gamecube/puyo-pop-fever
39,Siren,playstation-2,"Apr 20, 2004",['PlayStation 4'],72,7.9,SCE Japan Studio,SCEA,"['Action Adventure', ',                                            ', 'Horror', ' ']",1 Player,M,"(Also known as ""Forbidden Siren"") Keiichiro Toyama's Siren is a survival horror adventure title developed by Sony in the tradition of the ""Silent Hill"" series. Siren takes place in the Japanese village of Hanyuda, where the sea has turned blood red and the inhabitants are mutating into all manner of vile creatures.",https://metacritic.com/game/playstation-2/siren
40,Silent Hill 3,pc,"Apr  6, 2004",['PlayStation 2'],72,7.9,KCET,Konami,"['Action Adventure', ',                                            ', 'Horror', ',                                            ', 'Horror', ',                                            ', 'Survival', ' ']",No Online Multiplayer,T,"Silent Hill 3 continues the series' trademark brand of psychological horror and terrifying gameplay. As a teenage girl named Heather, players must explore and unravel the mysterious connection between the god-forsaken town and her inner fears. With enhanced graphical detail, a more complex storyline, and even more grotesque monsters than the previous games, Silent Hill 3 promises to be the best horror adventure ever. Features new monsters, items and weapons, including a submachine gun. [Konami]",https://metacritic.com/game/pc/silent-hill-3
41,Samurai Warriors: Xtreme Legends,playstation-2,"Nov  9, 2004",,72,8.7,Omega Force,Koei,"['Action', ',                                            ', ""Beat-'Em-Up"", ' ']",1-2 ,T,"This Playstation 2 exclusive expansion pack introduces new characters, and new chapters to the story of the Samurai Warriors.  Players discover more impressive weapons as well as a variety of new items and fighting skills. Along with new content, Samurai Warriors: Extreme Legends also opens up the original game's character growth system for continued character development, so that players can create more powerful warriors. Set in 16th century Japan, the fall of the Ashikaga Shogunate caused a series of major wars between individual warlords vying for power. This era in Japanese history became known as the Sengoku or ""warring states"" period. Samurai Warriors reveals the stories from this dramatic era and combines it with pure Tactical Action gameplay. [KOEI]",https://metacritic.com/game/playstation-2/samurai-warriors-xtreme-legends
42,Tom Clancy's Rainbow Six 3: Athena Sword,pc,"Mar  9, 2004",,72,7.1,Ubisoft Milan,Ubisoft,"['Action', ',                                            ', 'Shooter', ',                                            ', 'Shooter', ',                                            ', 'First-Person', ',                                            ', 'Tactical', ',                                            ', 'Modern', ',                                            ', 'Modern', ' ']",1-16 ,M,"Command Team RAINBOW, the world's most elite, multinational squad of counter-terrorist operatives, as they track the desperate remnants of a dangerous terrorist organization into exotic regions of the Mediterranean to prevent their agenda of international anarchy and destruction. Athena Sword boasts a host of standout features, including: All-new, eight-mission campaign in locations including Italy, Croatia, and Greece; Eight new Multiplayer levels; Five new multiplayer game modes; Three ""classic"" missions; Seven additional real-world weapons (for a whopping total of 64); Weapon sound effects from the team that worked on the blockbuster film The Matrix. [Ubi Soft]",https://metacritic.com/game/pc/tom-clancys-rainbow-six-3-athena-sword
43,Forgotten Realms: Demon Stone,xbox,"Nov 17, 2004","['PC', 'PlayStation 2']",72,6.1,Stormfront Studios,Atari,"['Action', ',                                            ', ""Beat-'Em-Up"", ' ']",1 Player,T,"A lone fighter, a brash sorcerer, a hot-tempered rogue... Three warriors, brought together by an unexplainable force, must now embark on a dangerous journey. You can take control of all three characters, switching between them to battle an onslaught of enemies. Use melee moves, projectile power, and stealth attacks to defeat creatures from the world of Dungeons & Dragons. Set within the Forgotten Realms, Demon Stone's locations include Gemspark Mines, Jungles of Chult, Underdark, and more.",https://metacritic.com/game/xbox/forgotten-realms-demon-stone
44,Lemony Snicket's A Series of Unfortunate Events,game-boy-advance,"Nov 10, 2004",['PlayStation 2'],72,8.0,Griptonite Games,Activision,"['Action', ',                                            ', 'Platformer', ',                                            ', '2D', ' ']",1 Player,E,"Based on the book series and the feature film, this game tells the tale of Violet, Klaus, and Sunny Baudelaire, whose parents perish in a fire. Soon after, they are sent to live with their sinister uncle, Count Olaf, in a cavernous mansion. Now you can help the Baudelaire orphans by using their special skills to journey through 15 missions, from the deep catacombs beneath Olaf's mansion to the gloomy shores of Lake Lachrymose. Collect household items and assemble them into contraptions for puzzle-solving and combat. Wield those items to battle Olaf's minions.",https://metacritic.com/game/game-boy-advance/lemony-snickets-a-series-of-unfortunate-events
45,Test Drive: Eve of Destruction,xbox,"Aug 25, 2004",['PlayStation 2'],72,8.8,Monster Games Inc.,Atari,"['Driving', ',                                            ', 'Demolition Derby', ' ']",1-4 ,T,"Having the fastest car doesn't guarantee you success in Test Drive: Eve of Destruction. If you can take out your opponents while minimizing damage to your own vehicle, you'll be the last one standing in 25 events, including Demo Derby, Suicide Race, and Figure 8 Race. Choose from more than 12 racing venues and a variety of vehicles, such as buses, hearses, and ambulances, and fight to the finish in single-player races or split-screen multiplayer battles.",https://metacritic.com/game/xbox/test-drive-eve-of-destruction
46,Sudeki,xbox,"Jul 20, 2004",['PC'],72,8.3,Climax Group,Microsoft Game Studios,"['Role-Playing', ',                                            ', 'Action RPG', ' ']",1 Player,M,"A sultry wizardress, a soaring gunslinger, a powerful swordsman, and a dark huntress are about to be hurtled into a dark adventure.  Set in a world ripped apart by deceit, the heroes of Sudeki journey down a twisting path of betrayal, gravity-defying combat, and unbelievable magic.  Sudeki pushes the limits of what you think an RPG can be, with bigger worlds, more powerful heroes, and sexier heroines--all wrapped up in Hong Kong-style cinematic combat.  ",https://metacritic.com/game/xbox/sudeki
47,Shrek 2,game-boy-advance,"Apr 28, 2004",,72,5.0,Vicarious Visions,Activision,"['Action', ',                                            ', 'Platformer', ',                                            ', '3D', ' ']",1 Player,E,"Shrek 2 takes players on a twisted fairy tale adventure with Shrek and his buddies.  Revisit key locations from the movie sequel while discovering all-new locations and characters.  Shrek 2 combines squad-based action with traditional action adventure elements.  You control a team of four and play as Shrek or any of his ten friends, switching between each to best utilize the character's unique abilities to solve puzzles, fight monsters, and complete wild and dangerous adventures.",https://metacritic.com/game/game-boy-advance/shrek-2
48,Sonic Heroes,gamecube,"Jan  5, 2004","['PC', 'PlayStation 2']",72,7.8,Sonic Team,Sega,"['Action', ',                                            ', 'Platformer', ',                                            ', '3D', ' ']",1-2 ,E,"Sonic Heroes brings the Sonic series to the PS2 and Xbox for the first time.  Dr.  Eggman is causing havoc again and it's up to you to maneuver a team of three Sonic characters through massive levels.  All 12 characters--divided into Team Sonic, Team Dark, Team Rose and Team Chaotix--have their own unique strengths, so choose your teams wisely.  Find the best combination to complete missions full of enemies, puzzles, and huge environments.  No matter what team you choose, the only direction is forward and the only way to get there is fast.",https://metacritic.com/game/gamecube/sonic-heroes
49,Sega GT Online,xbox,"Jan 27, 2004",,72,7.7,Wow Entertainment,Sega,"['Driving', ',                                            ', 'Racing', ',                                            ', 'GT / Street', ' ']",1-4 ,T,"It's time to take your glorious Sega GT 2002 race car out of hiding and show her off to the world.  Pit your superior racer against the revved up Xbox Live community and kiss bumpers with up to 12 drivers from around the globe while talking in real-time.  In this car-lovers paradise there are over 165 top-of-the-line race cars from 25 different manufacturers just waiting to be customized and put to the ultimate test of will and speed.  When you're not tearing around the pristine tracks at breakneck speeds, be sure to stop by the new Gathering mode to play minigames which will earn you cash and unlock new cars for racing in Sega GT 2002 mode.  ",https://metacritic.com/game/xbox/sega-gt-online
50,Zoo Tycoon 2,pc,"Nov 11, 2004",,72,7.9,Blue Fang Games,Microsoft Game Studios,"['Strategy', ',                                            ', 'Tycoon', ',                                            ', 'Management', ',                                            ', 'Tycoon', ',                                            ', 'Business / Tycoon', ' ']",1 Player,E,"Featuring 30 incredibly detailed animals, a dazzling array of building tools and objects, a new zoom feature, and 3D graphics that allow players to keep a closer eye on the action and craft more creative zoos, Zoo Tycoon 2 is set to crank up the excitement, challenge, and fun of building the ultimate zoo. Easy to start and easy to play, Zoo Tycoon 2 gets you up close and interacting with the animals and zoo, offering intuitive controls and fun tutorials that allow players of all ages to enjoy the game right out of the box. From the start, you'll be immersed in the zoo experience with new features including the Zoo Guest mode, in which you can walk around and enjoy the game like visitors on a day at the zoo; Zookeeper mode, which allows you to interact with your animals as never before; and a new Photo mode, which lets you snap pictures of your favorite animals and guests and share them online with friends. Zoopedia, detailing all types of entertaining and interesting facts about animals, rounds out the new and improved features of the upcoming game. Unlike the original Zoo Tycoon, the new version allows players to participate in up to three challenging gameplay types: Campaign, Freeform, and Sandbox. [Microsoft]",https://metacritic.com/game/pc/zoo-tycoon-2
51,The Political Machine,pc,"Aug 12, 2004",,72,5.4,Stardock,Ubisoft,"['Strategy', ',                                            ', 'General', ',                                            ', 'General', ' ']",1-2 ,T,"The Political Machine is a new strategy game in which you are the campaign manager for a candidate for President of the United States. Choose a political party, put together the dream presidential ticket and go for it.  Based on the real world, The Political Machine gives would-be candidates the taste of the challenge real candidates face.  Fund raising, campaigning, building support, going on ""The O'Maley Factor"" and other cable news shows to answer the tough questions, and more. The Political Machine is both a single player game against the computer and multiplayer against other players on the Internet. Scores can be optionally recorded to the Metaverse here on PoliticalMachine.com.  The game is currently in internal alpha and will be released in May of 2004. The beta should be available in mid March. On the other hand, PoliticalMachine.com has been designed not just as place to download and use the game but as neutral ground for political junkies to discuss the issues of the day with other players from around the world. Create your own articles, hang out in the forum, and become part of this new political discussion community. [Stardock]",https://metacritic.com/game/pc/the-political-machine
52,Sega SuperStars,playstation-2,"Nov  3, 2004",,72,7.0,Sonic Team,Sega,"['Miscellaneous', ',                                            ', 'Party', ' ']",1 Player,T,,https://metacritic.com/game/playstation-2/sega-superstars
53,Uru: The Path of the Shell,pc,"Jul  7, 2004",,72,7.0,Cyan Worlds,Ubisoft,"['Adventure', ',                                            ', '3D', ',                                            ', 'First-Person', ',                                            ', 'Fantasy', ',                                            ', 'Fantasy', ' ']",1 Player,E,"Uru: The Path of the Shell is the third piece of Myst's Uru adventure. This adventure's complete boxed set, Uru: Complete Chronicles, includes the content in Uru: Ages Beyond Myst, Myst Uru: To D?ni (the free downloadable expansion released in February) and Uru: The Path of the Shell. The Path of the Shell challenges and rewards players with many new puzzles, new clothing options (including reward clothing), new player journals, technical features (including swimming), and five all-new Relto customization options. [Ubisoft]",https://metacritic.com/game/pc/uru-the-path-of-the-shell
54,Shrek 2,xbox,"Apr 28, 2004",,72,5.6,"Luxoflux, Inc.",Activision,"['Action', ',                                            ', 'Platformer', ',                                            ', '3D', ' ']",1-4 ,E,"Shrek 2 takes players on a twisted fairy tale adventure with Shrek and his buddies.  Revisit key locations from the movie sequel while discovering all-new locations and characters.  Shrek 2 combines squad-based action with traditional action adventure elements.  You control a team of four and play as Shrek or any of his ten friends, switching between each to best utilize the character's unique abilities to solve puzzles, fight monsters, and complete wild and dangerous adventures.",https://metacritic.com/game/xbox/shrek-2
55,IndyCar Series 2005,xbox,"Jun 22, 2004",,72,tbd,Codemasters,Codemasters,"['Driving', ',                                            ', 'Racing', ',                                            ', 'Formula One', ' ']",1-12 ,E,"IndyCar Series 2005 lets you compete from Pole Day to Bump Day as one of 33 racers. You'll race an entire season that takes you from the Indianapolis 500 to other IndyCar Series tracks, including the Texas Motor Speedway, Chicagoland Speedway, Pikes Peak International Raceway, and the new Twin Ring Motegi Speedway in Japan. Now you can practice your driving skills in an updated Masterclass training mode, and then compete online against 11 other players.",https://metacritic.com/game/xbox/indycar-series-2005
56,All-Star Baseball 2005,playstation-2,"Apr  8, 2004",,72,8.6,Acclaim,Acclaim,"['Sports', ',                                            ', 'Traditional', ',                                            ', 'Baseball', ',                                            ', 'Sim', ' ']",1-4 ,E,"All-Star Baseball 2005 gives you the most realistic ""between the lines"" game play experience ever with ASB05's exclusive FielderCam. The perennial best selling Baseball videogame franchise is more fun and accessible than ever before, packed with exclusive feature innovations, online head-to-head play AND the deepest franchise mode of any baseball video game. [Acclaim]",https://metacritic.com/game/playstation-2/all-star-baseball-2005
57,Phantasy Star Online Episode III: C.A.R.D. Revolution,gamecube,"Mar  2, 2004",,71,8.3,Sonic Team,Sega,"['Miscellaneous', ',                                            ', 'Card Battle', ' ']",1-4 ,T,"A strangely powerful Photon-like substance found on Planet Ragol has spurred a raging battle between the Hunters and a rebel team called the Arkz.  The prized matter known as ""The Germ"" has unique replicating powers and can be sealed in small playing-card-sized packets.  Warriors carrying a deck of the sought-after cards can then bring unprecedented amounts of destructive weapons and creatures into battle.  Fight with the Hero Hunters or on the rebels' Dark Side and stack your decks accordingly.  You'll compose several powerful decks from nearly 500 cards featuring fighting moves, weapons, and PSO creatures.  ",https://metacritic.com/game/gamecube/phantasy-star-online-episode-iii-card-revolution
58,CT Special Forces,game-boy-advance,"Jan  4, 2004",,71,tbd,LSP,Hip Games,"['Action', ',                                            ', 'General', ' ']",1-2 ,T,"As part of the Counter-Terrorist Special Forces unit, you have all the necessary means for putting an end to the threat of terrorism. Your team comprises highly trained soldiers who can do anything from dressing in camouflage to initiating surgical strikes on the enemy. In both ground missions and air combat, you'll plunge into 12 levels that span jungles, cities, mountains, and deserts. You can equip your team with various state-of-the-art weapons, including assault rifles and rocket launchers. Multiplayer mode lets you team up with a friend to complete missions.",https://metacritic.com/game/game-boy-advance/ct-special-forces
