,title,platform,release_date,other_platforms,metascore,user_score,developer,publisher,genre,players,rating,summary,url
30,Shark Tale,game-boy-advance,"Sep 27, 2004",['PlayStation 2'],63,7.8,Vicarious Visions,Activision,"['Action', ',                                            ', 'General', ' ']",1 Player,E,"In the murky depths of the ocean, the fate of Reef City lies in the fins of one little fish--at least that's what he wants you to think. Dive into the underwater metropolis of Shark Tale and play as Oscar, a fast-talking fish whose little fib gets him into big trouble. Based on DreamWorks' animated film, Shark Tale features 25 missions that will have you exploring Reef City, racing through the coral, fighting Fish Fu and great white sharks, and dancing to the sounds of hip-hop tracks.",https://metacritic.com/game/game-boy-advance/shark-tale
31,The Incredibles,gamecube,"Oct 31, 2004",['PlayStation 2'],63,6.3,Heavy Iron Studios,THQ,"['Action Adventure', ',                                            ', 'Modern', ' ']",1 Player,T,"Superstrength, superspeed, invisibility, and elasticity are all the powers you have to combat evil in The Incredibles. You'll need them, because your enemies throw bombs, bullets, and lasers at you. Based on the movie from Pixar, The Incredibles tells the story of a family of undercover superheroes that is trying to live a quiet, suburban life but is forced back into action to save the world. As the film's main characters, you must fight, race, and solve puzzles in more than 18 action-packed levels.",https://metacritic.com/game/gamecube/the-incredibles
32,Gangland,pc,"Mar  4, 2004",,63,7.5,MediaMobsters,Whiptail Interactive,"['Strategy', ',                                            ', 'Real-Time', ',                                            ', 'Modern', ',                                            ', 'General', ',                                            ', 'Modern', ' ']",1-8 ,M,"GANGLAND is a fast pace arcade style action game that combines the RTT, RPG & SIM genres into a whole new breed. All wannabe mobster bosses can look forward to a unique experience that'll blow your brains out! SINGLEPLAYER STORY: There were five brothers Romano, Angelo, Sonny, Chico and Mario. As kids they were inseparable as they grew up on Sicily with their grandparents. As they grew older three of the brothers became more and more unsatisfied with the quiet life in the Mediterranean and one day they killed their own brother Chico in a fight whereafter they fled to the land of opportunity where they began each their own criminal career. That made grandpa very upset? He sent his fourth grandchild to America to track down and kill his malicious brothers and avenge the murder. First thing Mario should do when he arrives is to look up his uncle Vincente... MULTIPLAYER STORY: You take on the role of one of the four Italian brothers, Mario, Angelo, Romano or Sonny. Born into Sicilian mafia, you must work your way up within the family and compete with other mobs and gangsters for supremacy in Paradise City. [Whiptail Interactive]",https://metacritic.com/game/pc/gangland
33,Ridge Racer DS,ds,"Dec  7, 2004",,63,6.7,Namco,Namco,"['Driving', ',                                            ', 'Racing', ',                                            ', 'Arcade', ',                                            ', 'Arcade', ',                                            ', 'Automobile', ' ']",1-6 ,E,"From the arcade racing series gamers know and love, Ridge Racer DS delivers a whole new experience to racing fans by offering true analog steering through the Nintendo DS touch screen, up to six-player multiplayer races, a variety of exciting single-player racing modes and much more. Ridge Racer DS offers all the fast-paced action gamers have come to expect from the Ridge Racer name -- now in the palm of their hands on the Nintendo DS. [Namco]",https://metacritic.com/game/ds/ridge-racer-ds
34,,playstation-2,,,,,,,,,,,https://metacritic.com/game/playstation-2/pinball-hall-of-fame-the-gottlieb-collection
35,Drakengard,playstation-2,"Mar  2, 2004",,63,8.1,Cavia Inc.,Square Enix,"['Role-Playing', ',                                            ', 'Action RPG', ' ']",1 Player,M,"Conflict has erupted between the Empire and the Union. The Empire, once part of the Union itself, has forsaken peace and accumulated awesome power in a surprisingly short time. Caim, a Union warrior and former prince of a small kingdom destroyed by the Empire, has received word that his castle is under attack. To make matters worse, his sister, Furiae, is still trapped within its walls. In an effort to save her, Caim manages to infiltrate the castle gates, but is mortally wounded in the battle. Slowly dying from his wounds, Caim comes upon a captured red dragon that also lies on the brink of death. Desperate to survive and continue his battle with the hated Empire, Caim decides to enter a pact with thedragon. By nature, the dragon herself is a proud beast that is unwilling to cooperate with humans, but she, too, has no choice but to accept Caims offer in order to live. The pact is a bitter compromise, as it requires the human partner to sacrifice some part of his or her body; the price for Caim is the power of speech. But the instant Caim joins souls with the dragon, the two pactpartners are given new life, and become bound together until death. With his strength restored, Caim rescues Furiae and sends her away to safety with a childhood friend, Inuart. Caim and the dragon then begin their quest to unravel the mystery behind the Empires sudden rise to power.",https://metacritic.com/game/playstation-2/drakengard
36,Spyro: A Hero's Tail,gamecube,"Nov  3, 2004",['PlayStation 2'],62,6.7,Eurocom Entertainment Software,VU Games,"['Action', ',                                            ', 'Platformer', ',                                            ', '3D', ' ']",1 Player,E,"Spyro must save the Dragon Realms from the Evil Red Dragon who has planted light-sapping Dark Gems all over the Dragon Realms in an attempt to control the world. With the help of his allies, Spyro must seek out and destroy all of the Dark Gems to return the land back to normal and to save the Dragon Realms from the evil dragon's tyrannical control. Guide Spyro as he uses his new dragon powers, abilities, and gadgets in lush environments rife with new villains.",https://metacritic.com/game/gamecube/spyro-a-heros-tail
37,Dead Man's Hand,xbox,"Mar  3, 2004",['PC'],62,6.9,Human Head Studios,Atari,"['Action', ',                                            ', 'Shooter', ',                                            ', 'First-Person', ',                                            ', 'Historic', ' ']",1-8 ,T,"Now you can experience the best elements of the Western genre, brought straight from the silver screen to the Xbox. Dead Man's Hand is a first-person shooter set in the Wild West.  You assume the role of El Tejon, a master gunslinger who seeks vengeance.  As the story unfolds, you pursue members of ""The Nine,"" a gang of ruthless outlaws who betrayed you and left you for dead.    Gunslinging, bar brawls, horseback action sequences, train chases, and epic showdowns are just part of the historic feel to this bona fide Old West adventure.",https://metacritic.com/game/xbox/dead-mans-hand
38,Street Racing Syndicate,playstation-2,"Aug 31, 2004",['PC'],62,8.7,Eutechnyx,Namco,"['Driving', ',                                            ', 'Racing', ',                                            ', 'GT / Street', ' ']",1-4 ,T,"SRS is the first game to deliver authentic street racing action, featuring realistic cars, genuine aftermarket parts, and true-to-life driving physics. Live a life immersed in the underground world of real street racing. Customize and tune realistic vehicles with detailed auto upgrades including dozens of licensed aftermarket parts that physically appear on cars. Progress through the Philadelphia, Miami and Los Angeles street racing scenes. Outrun and outsmart the cops in high-speed late night chases. BET BIG. Race for money, pink slips or even the girlfriends of rival street racers! Experience real high-speed illegal street racing with true racing physics and authentic damage that affect both looks and performance. Compete in both illegal and official sanctioned racing events. [3DO]",https://metacritic.com/game/playstation-2/street-racing-syndicate
39,Crimson Tears,playstation-2,"Jul 21, 2004",,62,8.0,DreamFactory,Capcom,"['Action', ',                                            ', ""Beat-'Em-Up"", ' ']",1 Player,T,"Crimson Tears is a futuristic 3D action game set in Tokyo, year 2049. Players take on the role of one of three inhuman ""biological war weapons"" that must battle hordes of enemies and maneuver through maze like environments as they investigate the cause of a mysterious disaster that has left the city incapacitated. Crimson Tears features distinctive cel-shaded 3D characters and fast-paced fighting action intermixed with stylish CG movie sequences that unfold the enigmatic sci-fi story.The three main characters explore the headquarters of ""A.R.M.A.,"" the weapons manufacturer that created them. A mysterious incident has affected areas around the compound and has warped the city and buildings into a persistently shifting labyrinth. Utilizing their martial arts training and weapons they find in the labyrinth, they must battle their way past waves of biological weapon creations and fight their way to the core of A.R.M.A., where the answers to the mysteries lie. [Capcom]",https://metacritic.com/game/playstation-2/crimson-tears
40,Wings of War,xbox,"Aug 30, 2004",['PC'],62,5.0,Silver Wish Games,Gathering,"['Simulation', ',                                            ', 'Flight', ',                                            ', 'WWI', ' ']",1 Player,T,"In Wings of War, you can become one of the high-flying heroes who rule the skies. As a rookie pilot, you must demonstrate your courage against enemy planes by fighting in aerial duels. The dogfights take place in a variety of environments, which feature weather effects, seasonal changes, and combat scenarios. In addition to more than 70 missions, the game features side quests that range from delivering black-market goods to assassinating enemy officers. If you are good enough, you'll soon earn medals and ranks, fortune, and glory.",https://metacritic.com/game/xbox/wings-of-war
41,Mario Pinball Land,game-boy-advance,"Oct  4, 2004",,62,4.5,Fuse Games Limited,Nintendo,"['Miscellaneous', ',                                            ', 'Parlor', ',                                            ', 'Pinball', ' ']",1 Player,E,"Jumping has always helped Mario perform heroic feats, but in Mario Pinball Land, the plumber must learn how to roll to rescue the princess. When Bowser kidnaps Peach and escapes to another dimension, a scientist transforms Mario into a ball to chase after the fiend. Now you must use your flippers to shoot a much rounder Mario into doors that lead to new areas. In his new form, Mario is also useful for knocking down enemies, picking up special bonuses, and finding power-ups.",https://metacritic.com/game/game-boy-advance/mario-pinball-land
42,Digimon Racing,game-boy-advance,"Sep 13, 2004",,62,tbd,Griptonite Games,Bandai,"['Driving', ',                                            ', 'Racing', ',                                            ', 'Arcade', ' ']",1-4 ,E,"If you thought Digimon didn't drive cars, you're wrong. In Digimon Racing, the Digimon crew just got their first set of wheels, and they're ready to tear up more than 15 tracks. As your favorite Digimon character from the animated TV series, you'll drive a kart through lava fields, jungles, and cities in a variety of game modes, including Single Race, Cup Race, Boss Challenges, and Time Trial. Link Game Boy Advance systems with a Game Link Cable for head-to-head action for up to four players.",https://metacritic.com/game/game-boy-advance/digimon-racing
43,Pro Fishing Challenge,xbox,"Aug 31, 2004",,62,8.1,Opus,Atlus Co.,"['Sports', ',                                            ', 'Nature', ',                                            ', 'Fishing', ' ']",8  Online,E,"Cast your line, set your hook, and prepare for a realistic fishing simulation for the Xbox. Pro Fishing Challenge re-creates all the excitement and tension of fishing with four expansive lakes, simulated fish ecology, and variable environmental effects. Participate in a variety of Tournament modes and earn money to buy the latest tackle and equipment, including rods, lines, reels, and lures. With Xbox Live, you can challenge the best anglers around the world over the Internet.",https://metacritic.com/game/xbox/pro-fishing-challenge
44,The Incredibles,playstation-2,"Oct 31, 2004",,62,7.9,Heavy Iron Studios,THQ,"['Action Adventure', ',                                            ', 'Modern', ' ']",1 Player,T,"Super strength. Super speed. Invisibility. Elasticity. These are your powers. Bombs. Bullets. Robots. Lasers. Your enemy controls them all. The only way to survive being The Incredibles is to truly be incredible. From the Academy Award-winning creators of ""Toy Story,"" ""Monsters, Inc.,"" and ""Finding Nemo"" comes a new movie written by Pixar Animation Studios' Brad Bird (Iron Giant, The Simpsons). The Incredibles tells the story of a family of undercover superheroes that are trying to live a quiet, suburban life, but are forced back into action in order to save the world. The action/adventure game from THQ is based on the plotline of the movie, allowing you to play as all the film's main characters. Live the film's action, adventure, and humor over 18 levels, which are packed with fighting, racing, and puzzle action/adventure gameplay featuring the characters' unique superpowers. [THQ]",https://metacritic.com/game/playstation-2/the-incredibles
45,Headhunter: Redemption,playstation-2,"Sep 21, 2004",,62,7.1,Amuze,Sega,"['Action Adventure', ',                                            ', 'Sci-Fi', ' ']",1 Player,M,"Twenty years after the devastation caused by the Bloody Mary Virus, a new order has emerged, based on two distinct but totally independent worlds, divided by the ultimate consumerist society - 'Above' and 'Below'. Headhunter: Redemption continues the gripping story of Jack Wade, a veteran Headhunter keeping order in a futuristic world overrun with unchecked consumerism, vicious organized crime and mind-controlling mass media. When Jack and his protégé, the sassy, streetwise Leeza X, stumble upon an arms smuggling operation that threatens the status quo, they must work together to deliver an oblivious world from impending catastrophe, confronting their darkest fears beneath a shroud of evil that blankets the city. [Sega]",https://metacritic.com/game/playstation-2/headhunter-redemption
46,Northland,pc,"Mar 24, 2004",['iPhone/iPad'],62,8.6,Funatics Development GmbH,GMX Media,"['Strategy', ',                                            ', 'Real-Time', ',                                            ', 'Fantasy', ',                                            ', 'General', ',                                            ', 'Fantasy', ' ']",1-6 ,T,"The story begins where the plot of ""Cultures 2 - The Gates of Asgard"" ended. After perilous adventures our four heroes defeated the Midgard serpent and thus saved the world. A great celebration began and everyone was happy and content. But everything has to come to an end sometime, and time to say farewell came faster than our friends wanted.",https://metacritic.com/game/pc/northland
47,Lineage II: The Chaotic Chronicle,pc,"Apr 27, 2004",,62,6.9,NCSOFT,NCSOFT,"['Role-Playing', ',                                            ', 'Massively Multiplayer Online', ',                                            ', 'Massively Multiplayer', ',                                            ', 'Fantasy', ' ']",Massively Multiplayer,T,"NCsoft brings a whole new experience to the fantasy role playing game genre with Lineage II: The Chaotic Chronicle. This all-new game, developed and published by NCsoft, is a prequel to their blockbuster hit, Lineage. Set 150 years before Lineage, as the kingdom of Aden becomes a unified state, Lineage II: The Chaotic Chronicle is designed to show the struggles that take place during a time where several provinces come under one rule. Old loyalties must change, new structure must be established and national sovereignty and pride must be formed. However, a group of lands coming under single rule doesn't equate to immediate peace... In this world, many players fight for control over any and every piece of the new kingdom. [NCsoft]",https://metacritic.com/game/pc/lineage-ii-the-chaotic-chronicle
48,Godzilla: Save the Earth,playstation-2,"Nov  2, 2004",,62,8.5,"Pipeworks Software, Inc.",Atari,"['Action', ',                                            ', 'Fighting', ',                                            ', '3D', ' ']",4  Online,T,"In the single-player game, G-Force scientists have cracked Godzilla's genetic code from samples obtained during the Vortaak invasion.  Scientists have refined the code to grow super-enriched ""Godzilla-Matter"" -- a virtually indestructible substance with the exact physical properties as Godzilla's radioactive back spikes.  The Vortaak learn of the Godzilla Matter and strike Monster Island in an attempt to steal G-Cells and seize control of Earth's monsters. As Godzilla, the player awakens and fights to stop the UFOs from stealing G-Cells, and to free his fellow monsters from captivity.  Throughout the game's missions, Vorticia sends waves of monsters, UFOs, mind-controlled military and earth-threatening devices at Godzilla, who must fight to defeat the enemies and find the hidden G-Cells before the UFOs can steal them. The epic battle for Earth will range across the globe in more than a dozen massive, destructible city environments, including San Francisco, Los Angeles, Tokyo, Osaka and New York. Features a variety of online multiplayer options for up to four players where gamers can smash, bash and trash opposing monsters and cities in gargantuan online melees.  Player will be able to go head-to-head, three- or four-player free-for-all, or team up for two-on-two combat. Godzilla will face off against more than 18 classic Toho movie monsters, each carefully designed to recreate the authentic film look and feel.  Monsters include Godzilla 2000 and 90s,  King Ghidorah, Gigan, Mothra, SpaceGodzilla, Biollante and many more. [Atari]",https://metacritic.com/game/playstation-2/godzilla-save-the-earth
49,Dragon Ball Z: Buu's Fury,game-boy-advance,"Sep 14, 2004",,62,8.6,Webfoot Technologies,Atari,"['Role-Playing', ',                                            ', 'Console-style RPG', ' ']",24  Online,E,"Dragon Ball Z: Buu's Fury begins with the Other World Tournament Saga and continues through the Kid Buu Saga, the final chapter in the Dragon Ball Z story. In a game that combines action and role-playing game elements with exploration, enemies, boss enemies, puzzles, and quests, your ultimate goal is to defeat Buu. Choose the best character--Goku, Vegeta, Gohan, Goten, or Trunks--for each mission, create fusion characters whenever necessary, and unleash powerful attack combos and super moves.",https://metacritic.com/game/game-boy-advance/dragon-ball-z-buus-fury
50,Hot Wheels Stunt Track Challenge,playstation-2,"Nov 10, 2004",,62,7.8,Climax Group,THQ,"['Driving', ',                                            ', 'Racing', ',                                            ', 'Futuristic', ' ']",6  Online,E,"In the Hot Wheels Stunt Track Challenge videogames, players are thrust into competition on a hot new extreme game show -- on which they must complete perilous stunts and win intense races. The goal is to beat opponents and impress the audience with fearless maneuvers, in order to advance into other 'episodes' and win better cars. At the end of the season, the driver with the most courage and best stunt skills will cruise away in a gold-plated car as the Hot Wheels Champion. Players will choose from 30 authentic Hot Wheels cars to compete in 24 stunt challenges on 12 different tracks set in environments such as Buccaneer Bay, Jurassic Jam, Zero Gravity Zone, Tiki Island, Spider Alley and Lava Land. Before each race, players can enter the garage to customize their cars with unique colors, wheels and decals. [THQ]",https://metacritic.com/game/playstation-2/hot-wheels-stunt-track-challenge
51,Yu-Gi-Oh! Capsule Monster Coliseum,playstation-2,"Oct 26, 2004",,62,8.0,WinkySoft,Konami,"['Miscellaneous', ',                                            ', 'Card Battle', ' ']",1-2 ,E,"Yet another Yu-Gi-Oh! Strategy Board Game.  Prove your skills in heated battles on a multitude of game boards to attain the title of King of Capsule Monsters, the supreme rank of strength at the Coliseum. Move the monsters across the map and destroy the enemy. Map mutations can suddenly turn the tides of battle. Collect monsters to round out your deck and strengthen your army. Evolve and fuse your monsters to make your deck more powerful.",https://metacritic.com/game/playstation-2/yu-gi-oh!-capsule-monster-coliseum
52,Leisure Suit Larry: Magna Cum Laude,xbox,"Oct  5, 2004","['PC', 'PlayStation 2']",62,6.6,High Voltage Software,VU Games,"['Adventure', ',                                            ', 'Third-Person', ',                                            ', 'Modern', ' ']",1 Player,M,"When a TV dating show comes to campus, Larry Lovage, a typical college student, gets a chance for national exposure. If he can make any girl on campus swoon, he will become a campus legend. Follow Larry's exploits and misadventures as he attempts to develop relationships with female characters. Take a break from your conversations in a variety of minigames, including Quarters, Tapper, Trampoline, and Whack-a-mole. Leisure Suit Larry: Magna Cum Laude lets you explore 25 different locations around the college campus and adjoining parts of town. ",https://metacritic.com/game/xbox/leisure-suit-larry-magna-cum-laude
53,Vendetta Online,pc,"Nov  4, 2004",['iPhone/iPad'],62,7.0,Guild Software,Strategy First,"['Role-Playing', ',                                            ', 'Massively Multiplayer Online', ',                                            ', 'Massively Multiplayer', ',                                            ', 'Sci-Fi', ',                                            ', 'Sci-Fi', ' ']",Massively Multiplayer,T,"Vendetta Online is a massively multiplayer game, debuting this summer, which will permit thousands of players to interact as the pilots of spaceships in a vast universe. Users may build their characters in any direction they desire, becoming rich captains of industry, military heros, or outlaws. A fast-paced, realtime ""twitch"" style combat model gives intense action, coupled with the backdrop of RPG gameplay in a massive online galaxy. Three major player factions form a delicate balance of power, with several NPC sub-factions creating situations of economic struggle, political intrigue and conflict. The completely persistent universe and detailed storyline add to the depth of immersion, resulting in a unique online experience. [Guild Software]",https://metacritic.com/game/pc/vendetta-online
54,Athens 2004,playstation-2,"Jul 14, 2004",['PC'],61,7.4,Eurocom Entertainment Software,SCEA,"['Sports', ',                                            ', 'Olympic Sports', ' ']",1-4 ,E,"Athens 2004, The Official Videogame of the Olympic Games, celebrates the diversity of the Olympic Games by delivering a wide variety of Olympic sports. Aquatics includes the Swimming discipline featuring 100m Backstroke, 100m Breaststroke, 100m Butterfly and 100m Freestyle events. Athletics includes Track and Field areas (including High Jump, Long Jump, Triple Jump, Discus Throw, Javelin Throw, Pole Vault, Shot Put, 100m, 200m, 400m, 800m, 1500m, 100m Hurdles and 110m Hurdles events), as well as the Combined area (including Decathlon and Heptathlon). Gymnastics features the Artistic discipline including Floor Exercise, Rings and Vault events. Additional sports include Archery (Individual 70m event); Equestrian (Individual Mixed event for Jumping); Shooting (Skeet event); and Weightlifting (Clean & Jerk event). [SCEA]",https://metacritic.com/game/playstation-2/athens-2004
